{
    "$id": "https://w3id.org/pathogen/schemas/DGCProofOfVaccination.json",
    "$schema": "http://json-schema.org/draft-07/schema#",
    "$comment": "{\"term\": \"DGCProofOfVaccination\", \"@id\": \"https://w3id.org/pathogen#DGCProofOfVaccination\"}",
    "title": "Proof of Covid-19 Vaccination",
    "description": "A standard Covid19 Vaccination cert containing detailed data",
    "type": "object",
    "properties": {
      "@context": {
        "type": "array"
      },
      "type": {
        "oneOf": [
          {
            "type": "string"
          },
          {
            "type": "array"
          }
        ]
      },
      "vaccinationInformation" : {
          "$comment": "{\"term\": \"vaccinationInformation\", \"@id\": \"https://w3id.org/pathogen#DGCVaccinationInformation\"}",
          "title": "Vaccination information",
          "description": "Vaccination (event) information",
          "$ref": "https://w3id.org/pathogen/schemas/DGCVaccinationInformation.json"
      },
      "personalInformation" : {
        "$comment": "{\"term\": \"personalInformation\", \"@id\": \"https://w3id.org/pathogen#DGCSubject\"}",
        "title": "Vaccination Recipient",
        "description": "Vaccination subject (patient) information",
        "$ref": "https://w3id.org/pathogen/schemas/DGCSubject.json"
      }
    },
    "additionalProperties": false,
    "examples": []
}